{
  "schema_version": 1,
  "submission_id": "REPLACE_SUBMISSION_ID",
  "base_revision": "REPLACE_WITH_CURRENT_SHA256_REVISION",
  "idempotency_key": "REPLACE_WITH_UNIQUE_IDEMPOTENCY_KEY",
  "submitted_by": "REPLACE_ACTOR_OR_SESSION",
  "summary": "REPLACE_SUMMARY",
  "artifacts": [],
  "graph_delta": {
    "upsert_nodes": [],
    "upsert_edges": [],
    "retire_nodes": [],
    "remove_edges": []
  },
  "declared_impacts": [],
  "extensions": {}
}
